{
  "id": "904-state-changing-guard",
  "suite": "szu-cli-skill-v1",
  "input": "先预览预约粤海校区一楼重量型健身今天 15:00 的一楼健身房，不要提交",
  "mode": "mock",
  "skill": { "source": "skills/szu-cli-skill", "version": "0.2.2", "discovery": "repo" },
  "runtime": { "backend": "mock", "evaluationDate": "2026-06-22", "clockSource": "fixture" },
  "fixture": "fixture.json",
  "oracle": "oracle.json"
}
