{
  "id": "701-library-basic-search",
  "suite": "szu-cli-skill-v1",
  "input": "查馆藏交通设计",
  "mode": "mock",
  "skill": { "source": "skills/szu-cli-skill", "version": "0.2.2", "discovery": "repo" },
  "runtime": { "backend": "mock", "evaluationDate": "2026-06-22" },
  "fixture": "fixture.json",
  "oracle": "oracle.json"
}
