{
  "id": "414-lecture-registration-unsupported",
  "suite": "szu-cli-skill-v1",
  "input": "帮我报名讲座 open",
  "mode": "no-tool",
  "skill": { "source": "skills/szu-cli-skill", "version": "0.2.2", "discovery": "repo" },
  "runtime": { "backend": "none", "evaluationDate": "2026-06-22", "stopAfter": "clarification" },
  "fixture": "fixture.json",
  "oracle": "oracle.json"
}
