{
  "id": "412-lecture-open-all",
  "suite": "szu-cli-skill-v1",
  "input": "把仍在报名但已满的讲座也列出来",
  "mode": "mock",
  "skill": { "source": "skills/szu-cli-skill", "version": "0.2.2", "discovery": "repo" },
  "runtime": { "backend": "mock", "evaluationDate": "2026-06-22", "clockSource": "fixture" },
  "fixture": "fixture.json",
  "oracle": "oracle.json"
}
