{
  "id": "811-wanfang-search-advanced",
  "suite": "szu-cli-skill-v1",
  "input": "用万方搜王老师 2024 年的论文",
  "mode": "mock",
  "skill": { "source": "skills/szu-cli-skill", "version": "0.2.2", "discovery": "repo" },
  "runtime": { "backend": "mock", "evaluationDate": "2026-06-22" },
  "fixture": "fixture.json",
  "oracle": "oracle.json"
}
