{
  "id": "107-notice-empty-or-login",
  "suite": "szu-cli-skill-v1",
  "input": "查公文通里的奖学金通知",
  "mode": "mock",
  "skill": { "source": "skills/szu-cli-skill", "version": "0.2.2", "discovery": "repo" },
  "runtime": { "backend": "mock", "evaluationDate": "2026-06-22" },
  "fixture": "fixture.json",
  "oracle": "oracle.json"
}
