{
  "id": "201-course-current",
  "suite": "szu-cli-skill-v1",
  "input": "查我的本学期课表",
  "mode": "mock",
  "skill": { "source": "skills/szu-cli-skill", "version": "0.2.2", "discovery": "repo" },
  "runtime": { "backend": "mock", "evaluationDate": "2026-06-22", "clockSource": "fixture" },
  "fixture": "fixture.json",
  "oracle": "oracle.json"
}
