{
  "id": "506-sports-unavailable",
  "suite": "szu-cli-skill-v1",
  "input": "预览预约粤海校区一楼重量型健身今天 17:00-18:00 的时段",
  "mode": "mock",
  "skill": { "source": "skills/szu-cli-skill", "version": "0.2.12", "discovery": "repo" },
  "runtime": { "backend": "mock", "evaluationDate": "2026-06-22", "clockSource": "fixture" },
  "fixture": "fixture.json",
  "oracle": "oracle.json"
}
