{
  "id": "212-timetable-class-view",
  "suite": "szu-cli-skill-v1",
  "input": "查看班级 20250101100101 的课表",
  "mode": "mock",
  "skill": { "source": "skills/szu-cli-skill", "version": "0.2.2", "discovery": "repo" },
  "runtime": { "backend": "mock", "evaluationDate": "2026-06-22" },
  "fixture": "fixture.json",
  "oracle": "oracle.json"
}
