{
  "id": "332-completion-module-courses",
  "suite": "szu-cli-skill-v1",
  "input": "看看公共基础课程模块还没修哪些课",
  "mode": "mock",
  "skill": { "source": "skills/szu-cli-skill", "version": "0.2.2", "discovery": "repo" },
  "runtime": { "backend": "mock", "evaluationDate": "2026-06-22" },
  "fixture": "fixture.json",
  "oracle": "oracle.json"
}
