{
  "id": "604-electricity-network",
  "suite": "szu-cli-skill-v1",
  "input": "查深大新斋区红豆斋 838 的电费",
  "mode": "mock",
  "skill": { "source": "skills/szu-cli-skill", "version": "0.2.2", "discovery": "repo" },
  "runtime": { "backend": "mock", "evaluationDate": "2026-06-22" },
  "fixture": "fixture.json",
  "oracle": "oracle.json"
}
