{
  "id": "103-notice-publisher",
  "suite": "szu-cli-skill-v1",
  "input": "查土木与交通工程学院最近 10 条公文通",
  "mode": "mock",
  "skill": { "source": "skills/szu-cli-skill", "version": "0.2.2", "discovery": "repo" },
  "runtime": { "backend": "mock", "evaluationDate": "2026-06-22" },
  "fixture": "fixture.json",
  "oracle": "oracle.json"
}
