{
  "id": "401-program-list-item",
  "suite": "szu-cli-skill-v1",
  "input": "查我的专业培养方案和课程要求，方案代码是 2025-050101-01",
  "mode": "mock",
  "skill": { "source": "skills/szu-cli-skill", "version": "0.2.2", "discovery": "repo" },
  "runtime": { "backend": "mock", "evaluationDate": "2026-06-22" },
  "fixture": "fixture.json",
  "oracle": "oracle.json"
}
