{
  "id": "211-timetable-class-search",
  "suite": "szu-cli-skill-v1",
  "input": "找 2025 级汉语言文学的班级课表",
  "mode": "mock",
  "skill": { "source": "skills/szu-cli-skill", "version": "0.2.2", "discovery": "repo" },
  "runtime": { "backend": "mock", "evaluationDate": "2026-06-22" },
  "fixture": "fixture.json",
  "oracle": "oracle.json"
}
